{
  "story_key": "Lb9073751bd",
  "date": "2026-06-19",
  "story_title": "US restricts Anthropic AI exports as Europe seeks tech sovereignty",
  "n_articles_processed": 14,
  "sources": [
    {
      "speaker_name": "Jason Haley",
      "role_or_affiliation": "Memphis-area resident near xAI site",
      "speaker_type": "civilian",
      "speaker_affiliation_bucket": "civilian",
      "speaker_affiliation_kind": null,
      "exact_quote": "I can't live like this. I don't really know what my options are other than to get out of there,",
      "attributive_verb": "said",
      "stance_toward_target": "against",
      "signal_text_idx": 7,
      "bucket": "HEALTH_SAFETY",
      "outlet": "Mother Jones"
    },
    {
      "speaker_name": "Jason Haley",
      "role_or_affiliation": "Memphis-area resident near xAI site",
      "speaker_type": "civilian",
      "speaker_affiliation_bucket": "civilian",
      "speaker_affiliation_kind": null,
      "exact_quote": "But, with that being said, I don't know who would be willing to purchase that house if they come and look at it and that's what they're hearing.",
      "attributive_verb": "said",
      "stance_toward_target": "against",
      "signal_text_idx": 7,
      "bucket": "HEALTH_SAFETY",
      "outlet": "Mother Jones"
    },
    {
      "speaker_name": null,
      "role_or_affiliation": "US Department of Justice filing",
      "speaker_type": "spokesperson",
      "speaker_affiliation_bucket": "state",
      "speaker_affiliation_kind": "US Department of Justice",
      "exact_quote": "Grok's continued operation and availability is a matter of paramount national security,",
      "attributive_verb": "said",
      "stance_toward_target": "for",
      "signal_text_idx": 7,
      "bucket": "LEGALITY",
      "outlet": "Mother Jones"
    },
    {
      "speaker_name": null,
      "role_or_affiliation": "US Department of Justice filing",
      "speaker_type": "spokesperson",
      "speaker_affiliation_bucket": "state",
      "speaker_affiliation_kind": "US Department of Justice",
      "exact_quote": "deploy over 2,000 munitions to 2,000 distinct targets within 96 hours during Operation Epic Fury.",
      "attributive_verb": "said",
      "stance_toward_target": "for",
      "signal_text_idx": 7,
      "bucket": "SECURITY_DEFENSE",
      "outlet": "Mother Jones"
    },
    {
      "speaker_name": "Cameron Stanley",
      "role_or_affiliation": "Pentagon AI chief",
      "speaker_type": "official",
      "speaker_affiliation_bucket": "state",
      "speaker_affiliation_kind": "US Department of Defense",
      "exact_quote": "If xAI is hindered from continuing to improve and upgrade Grok…DoW's ability to meet its national security mission and keep pace with adversaries will be impaired.",
      "attributive_verb": "added",
      "stance_toward_target": "for",
      "signal_text_idx": 7,
      "bucket": "SECURITY_DEFENSE",
      "outlet": "Mother Jones"
    }
  ],
  "model": "claude-sonnet-4-6",
  "meta_version": "10.0.3"
}
