{
  "story_key": "L1545b12547",
  "date": "2026-08-19",
  "story_title": "Hichilema wins Zambia second term amid gunfire arrests and fraud claims",
  "n_articles_processed": 20,
  "sources": [
    {
      "speaker_name": "Hichilema",
      "role_or_affiliation": "President of Zambia",
      "speaker_type": "official",
      "speaker_affiliation_bucket": "state",
      "speaker_affiliation_kind": "Zambian Executive Branch",
      "exact_quote": "We receive your trust with humility and never take it for granted",
      "attributive_verb": "says",
      "stance_toward_target": "for",
      "signal_text_idx": 3,
      "bucket": "POLITICAL",
      "outlet": "Anadolu Agency English"
    },
    {
      "speaker_name": "Mundubile",
      "role_or_affiliation": "Presidential candidate, NRPUP leader",
      "speaker_type": "official",
      "speaker_affiliation_bucket": "political",
      "speaker_affiliation_kind": "National Restoration and Progress United Party (NRPUP)",
      "exact_quote": "a true reflection of what took place across this election",
      "attributive_verb": "said",
      "stance_toward_target": "against",
      "signal_text_idx": 4,
      "bucket": "LEGALITY",
      "outlet": "BBC Africa"
    },
    {
      "speaker_name": "Mundubile",
      "role_or_affiliation": "Presidential candidate, NRPUP leader",
      "speaker_type": "official",
      "speaker_affiliation_bucket": "political",
      "speaker_affiliation_kind": "National Restoration and Progress United Party (NRPUP)",
      "exact_quote": "We have evidence. We have records. We have documented what we could as events unfolded. We will now place that evidence before the appropriate legal institutions and pursue every lawful avenue available to us within the prescribed period,",
      "attributive_verb": "said",
      "stance_toward_target": "against",
      "signal_text_idx": 4,
      "bucket": "LEGALITY",
      "outlet": "BBC Africa"
    },
    {
      "speaker_name": null,
      "role_or_affiliation": "NRPUP party spokesperson",
      "speaker_type": "spokesperson",
      "speaker_affiliation_bucket": "political",
      "speaker_affiliation_kind": "National Restoration and Progress United Party (NRPUP)",
      "exact_quote": "secure location under the protection of an international human rights body due to threats made against him",
      "attributive_verb": "confirmed",
      "stance_toward_target": "against",
      "signal_text_idx": 4,
      "bucket": "SECURITY_DEFENSE",
      "outlet": "BBC Africa"
    },
    {
      "speaker_name": "Hichilema",
      "role_or_affiliation": "President of Zambia",
      "speaker_type": "official",
      "speaker_affiliation_bucket": "state",
      "speaker_affiliation_kind": "Zambian Executive Branch",
      "exact_quote": "We are truly humbled by the trust you have placed in our hands.",
      "attributive_verb": "said",
      "stance_toward_target": "for",
      "signal_text_idx": 4,
      "bucket": "POLITICAL",
      "outlet": "BBC Africa"
    },
    {
      "speaker_name": "Hichilema",
      "role_or_affiliation": "President of Zambia",
      "speaker_type": "official",
      "speaker_affiliation_bucket": "state",
      "speaker_affiliation_kind": "Zambian Executive Branch",
      "exact_quote": "To those citizens who preferred the ideas presented by our opponents, we hear you, and we will continue to work for you,",
      "attributive_verb": "added",
      "stance_toward_target": "for",
      "signal_text_idx": 4,
      "bucket": "POLITICAL",
      "outlet": "BBC Africa"
    },
    {
      "speaker_name": "Mundubile",
      "role_or_affiliation": "Presidential candidate, NRPUP leader",
      "speaker_type": "official",
      "speaker_affiliation_bucket": "political",
      "speaker_affiliation_kind": "National Restoration and Progress United Party (NRPUP)",
      "exact_quote": "We reject those allegations absolutely. Our campaign was built on two words: hope and peace.",
      "attributive_verb": "said",
      "stance_toward_target": "against",
      "signal_text_idx": 4,
      "bucket": "LEGALITY",
      "outlet": "BBC Africa"
    },
    {
      "speaker_name": "Mundubile",
      "role_or_affiliation": "Presidential candidate, NRPUP leader",
      "speaker_type": "official",
      "speaker_affiliation_bucket": "political",
      "speaker_affiliation_kind": "National Restoration and Progress United Party (NRPUP)",
      "exact_quote": "présenterait des preuves aux instances judiciaires compétentes et qu’il épuiserait toutes les voies légales",
      "attributive_verb": "déclarer",
      "stance_toward_target": "against",
      "signal_text_idx": 12,
      "bucket": "LEGALITY",
      "outlet": "Le Monde"
    },
    {
      "speaker_name": "Mundubile",
      "role_or_affiliation": "Main opposition candidate, NRPUP leader",
      "speaker_type": "official",
      "speaker_affiliation_bucket": "political",
      "speaker_affiliation_kind": "National Restoration and Progress United Party (NRPUP)",
      "exact_quote": "attempt on his life.",
      "attributive_verb": "called",
      "stance_toward_target": "against",
      "signal_text_idx": 14,
      "bucket": "SECURITY_DEFENSE",
      "outlet": "RT Africa"
    },
    {
      "speaker_name": "Hichilema",
      "role_or_affiliation": "President of Zambia",
      "speaker_type": "official",
      "speaker_affiliation_bucket": "state",
      "speaker_affiliation_kind": "Zambian Executive Branch",
      "exact_quote": "This election showed the world who we are: a nation of peace, a nation of law and order, a democratic nation that settles our differences at the ballot box, and nowhere else,",
      "attributive_verb": "said",
      "stance_toward_target": "for",
      "signal_text_idx": 14,
      "bucket": "POLITICAL",
      "outlet": "RT Africa"
    },
    {
      "speaker_name": "Mundubile",
      "role_or_affiliation": "Main opposition candidate, NRPUP leader",
      "speaker_type": "official",
      "speaker_affiliation_bucket": "political",
      "speaker_affiliation_kind": "National Restoration and Progress United Party (NRPUP)",
      "exact_quote": "We will pursue every legitimate and constitutional avenue available to seek justice,",
      "attributive_verb": "said",
      "stance_toward_target": "against",
      "signal_text_idx": 14,
      "bucket": "LEGALITY",
      "outlet": "RT Africa"
    },
    {
      "speaker_name": "Mundubile",
      "role_or_affiliation": "Main opposition candidate, NRPUP leader",
      "speaker_type": "official",
      "speaker_affiliation_bucket": "political",
      "speaker_affiliation_kind": "National Restoration and Progress United Party (NRPUP)",
      "exact_quote": "heavily armed personnel believed to be members of the Zambia army",
      "attributive_verb": "claimed",
      "stance_toward_target": "against",
      "signal_text_idx": 14,
      "bucket": "SECURITY_DEFENSE",
      "outlet": "RT Africa"
    },
    {
      "speaker_name": "Mundubile",
      "role_or_affiliation": "Main opposition candidate, NRPUP leader",
      "speaker_type": "official",
      "speaker_affiliation_bucket": "political",
      "speaker_affiliation_kind": "National Restoration and Progress United Party (NRPUP)",
      "exact_quote": "has no militia",
      "attributive_verb": "insist",
      "stance_toward_target": "against",
      "signal_text_idx": 14,
      "bucket": "SECURITY_DEFENSE",
      "outlet": "RT Africa"
    }
  ],
  "model": "claude-sonnet-4-6",
  "meta_version": "10.0.3"
}
