{
  "story_key": "Le6ff92fb33",
  "date": "2026-05-25",
  "story_title": "GKN Aerospace chemical tank threatens explosion in Garden Grove California",
  "n_articles_processed": 22,
  "sources": [
    {
      "speaker_name": "Zeldin",
      "role_or_affiliation": "EPA Administrator",
      "speaker_type": "official",
      "speaker_affiliation_bucket": "state",
      "speaker_affiliation_kind": "US Environmental Protection Agency",
      "exact_quote": "“We’re being told that the tank will fail, but there are different scenarios as to what that means,”",
      "attributive_verb": "told",
      "stance_toward_target": "neutral",
      "signal_text_idx": 17,
      "bucket": "POLITICAL",
      "outlet": "The Guardian World"
    },
    {
      "speaker_name": "McGovern",
      "role_or_affiliation": "Orange County Fire Authority Interim Chief",
      "speaker_type": "official",
      "speaker_affiliation_bucket": "state",
      "speaker_affiliation_kind": "Orange County Fire Authority",
      "exact_quote": "With this new information, it could change our trajectory and our strategy to this event,",
      "attributive_verb": "said",
      "stance_toward_target": "neutral",
      "signal_text_idx": 20,
      "bucket": "CAPACITY_RESOURCES",
      "outlet": "The Independent"
    },
    {
      "speaker_name": "McGovern",
      "role_or_affiliation": "Orange County Fire Authority Interim Chief",
      "speaker_type": "official",
      "speaker_affiliation_bucket": "state",
      "speaker_affiliation_kind": "Orange County Fire Authority",
      "exact_quote": "Last night was a successful operation for this emerging incident.",
      "attributive_verb": "said",
      "stance_toward_target": "neutral",
      "signal_text_idx": 20,
      "bucket": "CAPACITY_RESOURCES",
      "outlet": "The Independent"
    },
    {
      "speaker_name": "Umberg",
      "role_or_affiliation": "California State Senator",
      "speaker_type": "official",
      "speaker_affiliation_bucket": "political",
      "speaker_affiliation_kind": "California State Senate",
      "exact_quote": "That may avoid the two concerns that we all had,",
      "attributive_verb": "said",
      "stance_toward_target": "neutral",
      "signal_text_idx": 20,
      "bucket": "HEALTH_SAFETY",
      "outlet": "The Independent"
    },
    {
      "speaker_name": "Umberg",
      "role_or_affiliation": "California State Senator",
      "speaker_type": "official",
      "speaker_affiliation_bucket": "political",
      "speaker_affiliation_kind": "California State Senate",
      "exact_quote": "One was an explosion, the other was a leak of liquid material vaporizing into a toxic fume, a toxic plume.",
      "attributive_verb": "said",
      "stance_toward_target": "neutral",
      "signal_text_idx": 20,
      "bucket": "HEALTH_SAFETY",
      "outlet": "The Independent"
    },
    {
      "speaker_name": "Covey",
      "role_or_affiliation": "OCFA Incident Commander",
      "speaker_type": "official",
      "speaker_affiliation_bucket": "state",
      "speaker_affiliation_kind": "Orange County Fire Authority",
      "exact_quote": "There are literally two options left remaining: One, the tank fails and spills a total of about [6,000] to 7,000 gallons of very bad chemicals into the parking lot and that area,",
      "attributive_verb": "said",
      "stance_toward_target": "neutral",
      "signal_text_idx": 20,
      "bucket": "HEALTH_SAFETY",
      "outlet": "The Independent"
    },
    {
      "speaker_name": "Covey",
      "role_or_affiliation": "OCFA Incident Commander",
      "speaker_type": "official",
      "speaker_affiliation_bucket": "state",
      "speaker_affiliation_kind": "Orange County Fire Authority",
      "exact_quote": "Or two, the tank goes into a thermal runaway and blows up, affecting the tanks that are around it that have fuel or chemicals in them as well.",
      "attributive_verb": "said",
      "stance_toward_target": "neutral",
      "signal_text_idx": 20,
      "bucket": "HEALTH_SAFETY",
      "outlet": "The Independent"
    },
    {
      "speaker_name": "Newsom",
      "role_or_affiliation": "California Governor",
      "speaker_type": "official",
      "speaker_affiliation_bucket": "state",
      "speaker_affiliation_kind": "California State Government",
      "exact_quote": "The safety of Orange County residents is the top priority,",
      "attributive_verb": "said",
      "stance_toward_target": "neutral",
      "signal_text_idx": 20,
      "bucket": "POLITICAL",
      "outlet": "The Independent"
    },
    {
      "speaker_name": "Newsom",
      "role_or_affiliation": "California Governor",
      "speaker_type": "official",
      "speaker_affiliation_bucket": "state",
      "speaker_affiliation_kind": "California State Government",
      "exact_quote": "We are mobilizing every state resource ",
      "attributive_verb": "said",
      "stance_toward_target": "neutral",
      "signal_text_idx": 20,
      "bucket": "POLITICAL",
      "outlet": "The Independent"
    }
  ],
  "model": "claude-sonnet-4-6",
  "meta_version": "10.0.3"
}
