{
  "story_key": "L0808f9d8b8",
  "date": "2026-07-25",
  "story_title": "Trump threatens EU with substantial tariffs over Google fine",
  "n_articles_processed": 26,
  "sources": [
    {
      "speaker_name": "Trump",
      "role_or_affiliation": "US President",
      "speaker_type": "official",
      "speaker_affiliation_bucket": "state",
      "speaker_affiliation_kind": "US Executive Branch",
      "exact_quote": "\"entirely reversed.\"",
      "attributive_verb": "says",
      "stance_toward_target": "for",
      "signal_text_idx": 2,
      "bucket": "FAIRNESS",
      "outlet": "BBC World"
    },
    {
      "speaker_name": "Trump",
      "role_or_affiliation": "US President",
      "speaker_type": "official",
      "speaker_affiliation_bucket": "state",
      "speaker_affiliation_kind": "US Executive Branch",
      "exact_quote": "\"taking direct aim at GREAT American Companies!\"",
      "attributive_verb": "accused",
      "stance_toward_target": "for",
      "signal_text_idx": 4,
      "bucket": "POLITICAL",
      "outlet": "Daily Wire"
    },
    {
      "speaker_name": "Trump",
      "role_or_affiliation": "US President",
      "speaker_type": "official",
      "speaker_affiliation_bucket": "state",
      "speaker_affiliation_kind": "US Executive Branch",
      "exact_quote": "\"After having fined Apple, for no reason at all, ...\"",
      "attributive_verb": "wrote",
      "stance_toward_target": "for",
      "signal_text_idx": 4,
      "bucket": "POLITICAL",
      "outlet": "Daily Wire"
    },
    {
      "speaker_name": null,
      "role_or_affiliation": "Australia's trade minister",
      "speaker_type": "official",
      "speaker_affiliation_bucket": "state",
      "speaker_affiliation_kind": "Australian Government",
      "exact_quote": "'completely unjustified'",
      "attributive_verb": "calls",
      "stance_toward_target": "against",
      "signal_text_idx": 8,
      "bucket": "ECONOMIC",
      "outlet": "Globe and Mail"
    },
    {
      "speaker_name": "Trump",
      "role_or_affiliation": "US President",
      "speaker_type": "official",
      "speaker_affiliation_bucket": "state",
      "speaker_affiliation_kind": "US Executive Branch",
      "exact_quote": "“into the practice of ‘ROBBING’ American Companies and, in turn, the American Taxpayer”",
      "attributive_verb": "said",
      "stance_toward_target": "for",
      "signal_text_idx": 15,
      "bucket": "EXTERNAL_REGULATION",
      "outlet": "South China Morning Post"
    },
    {
      "speaker_name": "Trump",
      "role_or_affiliation": "US President",
      "speaker_type": "official",
      "speaker_affiliation_bucket": "state",
      "speaker_affiliation_kind": "US Executive Branch",
      "exact_quote": "\"The penalties will be entirely reversed and, we anticipate, a substantial TARIFF to be placed on them at the earliest possible moment,\"",
      "attributive_verb": "posted",
      "stance_toward_target": "for",
      "signal_text_idx": 15,
      "bucket": "EXTERNAL_REGULATION",
      "outlet": "South China Morning Post"
    },
    {
      "speaker_name": "Trump",
      "role_or_affiliation": "US President",
      "speaker_type": "official",
      "speaker_affiliation_bucket": "state",
      "speaker_affiliation_kind": "US Executive Branch",
      "exact_quote": "\"illegal and highly discriminatory\"",
      "attributive_verb": "described",
      "stance_toward_target": "for",
      "signal_text_idx": 19,
      "bucket": "FAIRNESS",
      "outlet": "TASS English"
    }
  ],
  "model": "claude-sonnet-4-6",
  "meta_version": "10.0.3"
}
