{
  "story_key": "Lcdf464fea1",
  "date": "2026-05-25",
  "story_title": "Senegal President Faye sacks PM Sonko, parliament speaker resigns",
  "n_articles_processed": 12,
  "sources": [
    {
      "speaker_name": "Ndiaye",
      "role_or_affiliation": "Parliament Speaker",
      "speaker_type": "official",
      "speaker_affiliation_bucket": "state",
      "speaker_affiliation_kind": "National Assembly of Senegal",
      "exact_quote": "âhigher interest of the nationâ",
      "attributive_verb": "said",
      "stance_toward_target": "unclear",
      "signal_text_idx": 7,
      "bucket": "south_africa",
      "outlet": "Daily Maverick"
    },
    {
      "speaker_name": "Ndiaye",
      "role_or_affiliation": "Président de l'Assemblée nationale du Sénégal",
      "speaker_type": "official",
      "speaker_affiliation_bucket": "state",
      "speaker_affiliation_kind": "Assemblée nationale du Sénégal",
      "exact_quote": "« Après une profonde réflexion, mûrie dans le silence, la responsabilité et le sens de l’État, j’ai décidé de démissionner de mes fonctions de Président de l’Assemblée nationale du Sénégal. Cette décision procède d’un choix personnel, guidé avant tout par ma conception des institutions, de la responsabilité publique et de l’intérêt supérieur de la Nation »",
      "attributive_verb": "écrit",
      "stance_toward_target": "unclear",
      "signal_text_idx": 9,
      "bucket": "africa_other",
      "outlet": "RFI Afrique"
    }
  ],
  "model": "claude-sonnet-4-6",
  "meta_version": "10.0.3"
}
