{
  "story_key": "L6d66299386",
  "date": "2026-10-10",
  "story_title": "Magnitude 7.7 earthquake strikes central Panama triggering tsunami warnings",
  "n_articles_processed": 18,
  "sources": [
    {
      "speaker_name": null,
      "role_or_affiliation": "Unnamed Panamanian source",
      "speaker_type": "unknown",
      "speaker_affiliation_bucket": "unknown",
      "speaker_affiliation_kind": null,
      "exact_quote": "Un grand désastre",
      "attributive_verb": "said",
      "stance_toward_target": "neutral",
      "signal_text_idx": 1,
      "bucket": "QUALITY_OF_LIFE",
      "outlet": "AFP / France 24 FR"
    }
  ],
  "model": "claude-sonnet-4-6",
  "meta_version": "10.0.3"
}
