{
  "story_key": "Ldd9fcfc1d8",
  "date": "2026-08-30",
  "story_title": "Milo Yiannopoulos deported from US after overstaying visa",
  "n_articles_processed": 17,
  "sources": [
    {
      "speaker_name": null,
      "role_or_affiliation": "Department of Homeland Security spokesperson",
      "speaker_type": "spokesperson",
      "speaker_affiliation_bucket": "state",
      "speaker_affiliation_kind": "US Department of Homeland Security",
      "exact_quote": "“chose to overstay his welcome in violation of our nation’s laws.”",
      "attributive_verb": "said",
      "stance_toward_target": "for",
      "signal_text_idx": 1,
      "bucket": "CRIME_PUNISHMENT",
      "outlet": "Breitbart"
    },
    {
      "speaker_name": null,
      "role_or_affiliation": "Department of Homeland Security",
      "speaker_type": "spokesperson",
      "speaker_affiliation_bucket": "state",
      "speaker_affiliation_kind": "US Department of Homeland Security",
      "exact_quote": "“Being in detention is a choice. We encourage all illegal aliens to take control of their departure with the CBP Home App. The United States is offering illegal aliens $3,000 and a free flight to self-deport now,”",
      "attributive_verb": "said",
      "stance_toward_target": "for",
      "signal_text_idx": 1,
      "bucket": "POLICY_PRESCRIPTION",
      "outlet": "Breitbart"
    },
    {
      "speaker_name": null,
      "role_or_affiliation": "Department of Homeland Security",
      "speaker_type": "spokesperson",
      "speaker_affiliation_bucket": "state",
      "speaker_affiliation_kind": "US Department of Homeland Security",
      "exact_quote": "“We encourage every person here illegally to take advantage of this offer and reserve the chance to come back to the U.S. the right legal way to live the American dream. If not, you will be arrested and deported without a chance to return.”",
      "attributive_verb": "said",
      "stance_toward_target": "for",
      "signal_text_idx": 1,
      "bucket": "POLICY_PRESCRIPTION",
      "outlet": "Breitbart"
    },
    {
      "speaker_name": null,
      "role_or_affiliation": "Homeland Security spokesperson",
      "speaker_type": "spokesperson",
      "speaker_affiliation_bucket": "state",
      "speaker_affiliation_kind": "US Department of Homeland Security",
      "exact_quote": "“He chose to overstay his welcome in violation of our nation’s laws,”",
      "attributive_verb": "said",
      "stance_toward_target": "for",
      "signal_text_idx": 5,
      "bucket": "CRIME_PUNISHMENT",
      "outlet": "Globe and Mail"
    },
    {
      "speaker_name": "Yiannopoulos",
      "role_or_affiliation": "right-wing commentator",
      "speaker_type": "journalist",
      "speaker_affiliation_bucket": "unknown",
      "speaker_affiliation_kind": null,
      "exact_quote": "“Zero immigration for the next 20 years. No ifs, no buts,”",
      "attributive_verb": "said",
      "stance_toward_target": "unclear",
      "signal_text_idx": 5,
      "bucket": "POLITICAL",
      "outlet": "Globe and Mail"
    },
    {
      "speaker_name": null,
      "role_or_affiliation": "Department of Homeland Security",
      "speaker_type": "spokesperson",
      "speaker_affiliation_bucket": "state",
      "speaker_affiliation_kind": "US Department of Homeland Security",
      "exact_quote": "“We encourage every person here illegally to take advantage of this offer and reserve the chance to come back to the U.S. the right legal way to live the American dream. If not, you will be arrested and deported without a chance to return,”",
      "attributive_verb": "said",
      "stance_toward_target": "for",
      "signal_text_idx": 5,
      "bucket": "POLICY_PRESCRIPTION",
      "outlet": "Globe and Mail"
    }
  ],
  "model": "claude-sonnet-4-6",
  "meta_version": "10.0.3"
}