{
  "story_key": "L534ad28f0a",
  "date": "2026-07-24",
  "story_title": "DOJ drops New York Times subpoenas over Air Force One reporting",
  "n_articles_processed": 11,
  "sources": [
    {
      "speaker_name": null,
      "role_or_affiliation": "federal judge",
      "speaker_type": "official",
      "speaker_affiliation_bucket": "state",
      "speaker_affiliation_kind": "US Federal Judiciary",
      "exact_quote": "sloppy legal work",
      "attributive_verb": "call",
      "stance_toward_target": "against",
      "signal_text_idx": 10,
      "bucket": "LEGALITY",
      "outlet": "The Independent"
    },
    {
      "speaker_name": null,
      "role_or_affiliation": "federal judge",
      "speaker_type": "official",
      "speaker_affiliation_bucket": "state",
      "speaker_affiliation_kind": "US Federal Judiciary",
      "exact_quote": "Subpoenas are the last step, not the first step, but the last step,",
      "attributive_verb": "declare",
      "stance_toward_target": "against",
      "signal_text_idx": 10,
      "bucket": "LEGALITY",
      "outlet": "The Independent"
    },
    {
      "speaker_name": null,
      "role_or_affiliation": "The New York Times",
      "speaker_type": "journalist",
      "speaker_affiliation_bucket": "corporate",
      "speaker_affiliation_kind": "The New York Times",
      "exact_quote": "intimidate",
      "attributive_verb": "challenge",
      "stance_toward_target": "against",
      "signal_text_idx": 9,
      "bucket": "LEGALITY",
      "outlet": "The Hindu Intl"
    }
  ],
  "model": "claude-sonnet-4-6",
  "meta_version": "10.0.3"
}
