{
  "story_key": "L906f753c7e",
  "date": "2026-09-01",
  "story_title": "Duane 'Keffe D' Davis convicted of murdering Tupac Shakur",
  "n_articles_processed": 27,
  "sources": [
    {
      "speaker_name": null,
      "role_or_affiliation": "jury foreperson",
      "speaker_type": "civilian",
      "speaker_affiliation_bucket": "unknown",
      "speaker_affiliation_kind": null,
      "exact_quote": "Count one, murder with use of a deadly weapon, guilty of first-degree murder with use of a deadly weapon,",
      "attributive_verb": "announced",
      "stance_toward_target": "neutral",
      "signal_text_idx": 2,
      "bucket": "pan_african",
      "outlet": "AfricaNews"
    },
    {
      "speaker_name": "Palal",
      "role_or_affiliation": "prosecutor",
      "speaker_type": "official",
      "speaker_affiliation_bucket": "state",
      "speaker_affiliation_kind": "Clark County District Attorney's Office",
      "exact_quote": "Duane Davis, in the culture of gangs, could not let that stand,",
      "attributive_verb": "said",
      "stance_toward_target": "for",
      "signal_text_idx": 2,
      "bucket": "pan_african",
      "outlet": "AfricaNews"
    },
    {
      "speaker_name": "Palal",
      "role_or_affiliation": "prosecutor",
      "speaker_type": "official",
      "speaker_affiliation_bucket": "state",
      "speaker_affiliation_kind": "Clark County District Attorney's Office",
      "exact_quote": "So what did he do? He acquired a firearm, got his group together, and went hunting for Mr Shakur.",
      "attributive_verb": "said",
      "stance_toward_target": "for",
      "signal_text_idx": 2,
      "bucket": "pan_african",
      "outlet": "AfricaNews"
    },
    {
      "speaker_name": "Sanft",
      "role_or_affiliation": "defense attorney",
      "speaker_type": "unknown",
      "speaker_affiliation_bucket": "unknown",
      "speaker_affiliation_kind": null,
      "exact_quote": "bulls***",
      "attributive_verb": "dismissed",
      "stance_toward_target": "against",
      "signal_text_idx": 18,
      "bucket": "pakistan",
      "outlet": "Geo News English"
    }
  ],
  "model": "claude-sonnet-4-6",
  "meta_version": "10.0.3"
}
