{
  "story_key": "Lb54c92acd7",
  "date": "2026-08-23",
  "story_title": "Lula-Trump phone call shapes Brazilian electoral debate",
  "n_articles_processed": 9,
  "sources": [
    {
      "speaker_name": null,
      "role_or_affiliation": "unnamed speaker (pro-Bolsonaro framing)",
      "speaker_type": "unknown",
      "speaker_affiliation_bucket": "political",
      "speaker_affiliation_kind": null,
      "exact_quote": "\"O governo Trump 2.0 está melhor do que Trump 1.0, certo? Pois bem, Bolsonaro 2.0 também será muito melhor.\"",
      "attributive_verb": "said",
      "stance_toward_target": "against",
      "signal_text_idx": 4,
      "bucket": "brazil",
      "outlet": "Folha de São Paulo"
    }
  ],
  "model": "claude-sonnet-4-6",
  "meta_version": "10.0.3"
}
