{
  "story_key": "Lafc449e6d4",
  "date": "2026-07-16",
  "story_title": "Trump reverses ICE traffic stop suspension after two fatal shootings",
  "n_articles_processed": 23,
  "sources": [
    {
      "speaker_name": "Trump",
      "role_or_affiliation": "US President",
      "speaker_type": "official",
      "speaker_affiliation_bucket": "state",
      "speaker_affiliation_kind": "US Executive Branch",
      "exact_quote": "we CANNOT give up one of I.C.E.'s most important and effective Crime Fighting tools, THE TRAFFIC STOP!",
      "attributive_verb": "wrote",
      "stance_toward_target": "for",
      "signal_text_idx": 0,
      "bucket": "SECURITY_DEFENSE",
      "outlet": "Axios World"
    },
    {
      "speaker_name": "Moran",
      "role_or_affiliation": "Professor and founder of the Criminal and Juvenile Defense Clinic, University of St. Thomas School of Law",
      "speaker_type": "expert",
      "speaker_affiliation_bucket": "academic",
      "speaker_affiliation_kind": "University of St. Thomas School of Law",
      "exact_quote": "I would like to see, first of all, a policy that's in line with the vast majority of police departments in the country, which is that you don't shoot at moving vehicles,",
      "attributive_verb": "said",
      "stance_toward_target": "against",
      "signal_text_idx": 3,
      "bucket": "POLICY_PRESCRIPTION",
      "outlet": "CBC World"
    },
    {
      "speaker_name": "Moran",
      "role_or_affiliation": "Professor and founder of the Criminal and Juvenile Defense Clinic, University of St. Thomas School of Law",
      "speaker_type": "expert",
      "speaker_affiliation_bucket": "academic",
      "speaker_affiliation_kind": "University of St. Thomas School of Law",
      "exact_quote": "Everyone knows it's really dangerous.",
      "attributive_verb": "says",
      "stance_toward_target": "against",
      "signal_text_idx": 3,
      "bucket": "POLICY_PRESCRIPTION",
      "outlet": "CBC World"
    },
    {
      "speaker_name": null,
      "role_or_affiliation": "DHS spokesperson",
      "speaker_type": "spokesperson",
      "speaker_affiliation_bucket": "state",
      "speaker_affiliation_kind": "US Department of Homeland Security",
      "exact_quote": "fearing for public safety,",
      "attributive_verb": "said",
      "stance_toward_target": "for",
      "signal_text_idx": 3,
      "bucket": "LEGALITY",
      "outlet": "CBC World"
    },
    {
      "speaker_name": null,
      "role_or_affiliation": "ICE agent",
      "speaker_type": "official",
      "speaker_affiliation_bucket": "state",
      "speaker_affiliation_kind": "US Immigration and Customs Enforcement",
      "exact_quote": "I’m Happy",
      "attributive_verb": "said",
      "stance_toward_target": "for",
      "signal_text_idx": 5,
      "bucket": "SECURITY_DEFENSE",
      "outlet": "Daily Wire"
    },
    {
      "speaker_name": null,
      "role_or_affiliation": "DHS spokesperson",
      "speaker_type": "spokesperson",
      "speaker_affiliation_bucket": "state",
      "speaker_affiliation_kind": "US Department of Homeland Security",
      "exact_quote": "as a weapon,",
      "attributive_verb": "said",
      "stance_toward_target": "for",
      "signal_text_idx": 7,
      "bucket": "LEGALITY",
      "outlet": "El Pais English"
    },
    {
      "speaker_name": null,
      "role_or_affiliation": "DHS spokesperson",
      "speaker_type": "spokesperson",
      "speaker_affiliation_bucket": "state",
      "speaker_affiliation_kind": "US Department of Homeland Security",
      "exact_quote": "feared for public safety",
      "attributive_verb": "said",
      "stance_toward_target": "for",
      "signal_text_idx": 7,
      "bucket": "LEGALITY",
      "outlet": "El Pais English"
    },
    {
      "speaker_name": null,
      "role_or_affiliation": "DHS spokesperson",
      "speaker_type": "spokesperson",
      "speaker_affiliation_bucket": "state",
      "speaker_affiliation_kind": "US Department of Homeland Security",
      "exact_quote": "was attempting to flee the scene.",
      "attributive_verb": "said",
      "stance_toward_target": "for",
      "signal_text_idx": 7,
      "bucket": "LEGALITY",
      "outlet": "El Pais English"
    },
    {
      "speaker_name": "Durán Guerrero",
      "role_or_affiliation": "Colombian motorist, victim",
      "speaker_type": "civilian",
      "speaker_affiliation_bucket": "civilian",
      "speaker_affiliation_kind": null,
      "exact_quote": "I tried to stop",
      "attributive_verb": "say",
      "stance_toward_target": "neutral",
      "signal_text_idx": 11,
      "bucket": "MORALITY",
      "outlet": "Globe and Mail"
    },
    {
      "speaker_name": "Trump",
      "role_or_affiliation": "US President",
      "speaker_type": "official",
      "speaker_affiliation_bucket": "state",
      "speaker_affiliation_kind": "US Executive Branch",
      "exact_quote": "We must be strong, tough, and smart, and we CANNOT give up one of I.C.E.’s most important and effective Crime Fighting tools,",
      "attributive_verb": "said",
      "stance_toward_target": "for",
      "signal_text_idx": 16,
      "bucket": "POLITICAL",
      "outlet": "Mother Jones"
    },
    {
      "speaker_name": "Ocasio-Cortez",
      "role_or_affiliation": "US Representative (NY-14)",
      "speaker_type": "official",
      "speaker_affiliation_bucket": "political",
      "speaker_affiliation_kind": "US House of Representatives",
      "exact_quote": "This is the guy that said he could shoot someone on Fifth Avenue, and people would still support him. And now he has an agency shooting people out in the street",
      "attributive_verb": "said",
      "stance_toward_target": "against",
      "signal_text_idx": 20,
      "bucket": "POLITICAL",
      "outlet": "The Independent"
    }
  ],
  "model": "claude-sonnet-4-6",
  "meta_version": "10.0.3"
}
