{
  "story_key": "Lcc6a9e2c00",
  "date": "2026-09-27",
  "story_title": "Unusually powerful nor'easter batters US Northeast with flooding and outages",
  "n_articles_processed": 19,
  "sources": [
    {
      "speaker_name": null,
      "role_or_affiliation": "US authorities",
      "speaker_type": "official",
      "speaker_affiliation_bucket": "state",
      "speaker_affiliation_kind": "US government / emergency management",
      "exact_quote": "This storm is expected to bring major coastal flooding to the mid-Atlantic coast.",
      "attributive_verb": "warned",
      "stance_toward_target": "neutral",
      "signal_text_idx": 14,
      "bucket": "taiwan_hk",
      "outlet": "South China Morning Post"
    }
  ],
  "model": "claude-sonnet-4-6",
  "meta_version": "10.0.3"
}
