{
  "story_key": "L5107a4c65d",
  "date": "2026-08-04",
  "story_title": "UEFA declares no confidence in FIFA after World Cup stake sale collapses",
  "n_articles_processed": 16,
  "sources": [
    {
      "speaker_name": null,
      "role_or_affiliation": "senior UEFA sources",
      "speaker_type": "spokesperson",
      "speaker_affiliation_bucket": "NGO",
      "speaker_affiliation_kind": "UEFA",
      "exact_quote": "non co-operation",
      "attributive_verb": "threaten",
      "stance_toward_target": "against",
      "signal_text_idx": 3,
      "bucket": "uk",
      "outlet": "BBC World"
    }
  ],
  "model": "claude-sonnet-4-6",
  "meta_version": "10.0.3"
}
