{
  "story_key": "L2f7e5c7fed",
  "date": "2026-09-23",
  "story_title": "Russia pounds Kyiv with drones hours after Zelensky-Trump UN talks",
  "n_articles_processed": 19,
  "sources": [
    {
      "speaker_name": "Mathernova",
      "role_or_affiliation": "EU Ambassador to Ukraine",
      "speaker_type": "official",
      "speaker_affiliation_bucket": "state",
      "speaker_affiliation_kind": "European Union Delegation to Ukraine",
      "exact_quote": "\"This is the view from the windows of the EU Delegation today. Buildings nearby are burning,\"",
      "attributive_verb": "said",
      "stance_toward_target": "against",
      "signal_text_idx": 1,
      "bucket": "SECURITY_DEFENSE",
      "outlet": "Daily Sabah"
    },
    {
      "speaker_name": "Zelenskyy",
      "role_or_affiliation": "Ukrainian President",
      "speaker_type": "official",
      "speaker_affiliation_bucket": "state",
      "speaker_affiliation_kind": "Ukrainian Executive Branch",
      "exact_quote": "\"any format\"",
      "attributive_verb": "said",
      "stance_toward_target": "against",
      "signal_text_idx": 1,
      "bucket": "POLITICAL",
      "outlet": "Daily Sabah"
    },
    {
      "speaker_name": null,
      "role_or_affiliation": "Russian Defence Ministry",
      "speaker_type": "spokesperson",
      "speaker_affiliation_bucket": "state",
      "speaker_affiliation_kind": "Russian Defence Ministry",
      "exact_quote": "\"group strikes\"",
      "attributive_verb": "said",
      "stance_toward_target": "for",
      "signal_text_idx": 12,
      "bucket": "ECONOMIC",
      "outlet": "The Hindu Intl"
    },
    {
      "speaker_name": null,
      "role_or_affiliation": "Russian Defence Ministry",
      "speaker_type": "spokesperson",
      "speaker_affiliation_bucket": "state",
      "speaker_affiliation_kind": "Russian Defence Ministry",
      "exact_quote": "\"military-industrial and energy sector facilities, logistics centres and maritime vessels.\"",
      "attributive_verb": "said",
      "stance_toward_target": "for",
      "signal_text_idx": 12,
      "bucket": "ECONOMIC",
      "outlet": "The Hindu Intl"
    }
  ],
  "model": "claude-haiku-4-5",
  "meta_version": "10.0.3"
}
