{
  "story_key": "L5033a36620",
  "date": "2026-09-09",
  "story_title": "Trump bans Canadian alcohol, dairy, motorcycles as trade war deepens",
  "n_articles_processed": 21,
  "sources": [
    {
      "speaker_name": "Trump",
      "role_or_affiliation": "US President",
      "speaker_type": "official",
      "speaker_affiliation_bucket": "state",
      "speaker_affiliation_kind": "US Executive Branch",
      "exact_quote": "discriminating",
      "attributive_verb": "said",
      "stance_toward_target": "for",
      "signal_text_idx": 3,
      "bucket": "FAIRNESS",
      "outlet": "BBC World"
    },
    {
      "speaker_name": "LeBlanc",
      "role_or_affiliation": "Canada's trade minister",
      "speaker_type": "official",
      "speaker_affiliation_bucket": "state",
      "speaker_affiliation_kind": "Canadian Federal Government",
      "exact_quote": "unjustified",
      "attributive_verb": "said",
      "stance_toward_target": "against",
      "signal_text_idx": 3,
      "bucket": "FAIRNESS",
      "outlet": "BBC World"
    },
    {
      "speaker_name": "Carney",
      "role_or_affiliation": "Canadian Prime Minister",
      "speaker_type": "official",
      "speaker_affiliation_bucket": "state",
      "speaker_affiliation_kind": "Canadian Federal Government",
      "exact_quote": "will come at a cost",
      "attributive_verb": "said",
      "stance_toward_target": "against",
      "signal_text_idx": 3,
      "bucket": "ECONOMIC",
      "outlet": "BBC World"
    },
    {
      "speaker_name": "LeBlanc",
      "role_or_affiliation": "Canada's trade minister",
      "speaker_type": "official",
      "speaker_affiliation_bucket": "state",
      "speaker_affiliation_kind": "Canadian Federal Government",
      "exact_quote": "Our core focus is on what we can control: building strength at home, diversifying our partnerships abroad, and building Canada strong for all Canadians,",
      "attributive_verb": "said",
      "stance_toward_target": "against",
      "signal_text_idx": 3,
      "bucket": "FAIRNESS",
      "outlet": "BBC World"
    },
    {
      "speaker_name": "Brown",
      "role_or_affiliation": "Chief North America Economist, Capital Economics",
      "speaker_type": "expert",
      "speaker_affiliation_bucket": "corporate",
      "speaker_affiliation_kind": "Capital Economics",
      "exact_quote": "Nonetheless, Trump's willingness to impose an import ban is further evidence, if it were needed, that these latest measures are about inflicting economic pain rather than raising revenue.",
      "attributive_verb": "said",
      "stance_toward_target": "neutral",
      "signal_text_idx": 3,
      "bucket": "ECONOMIC",
      "outlet": "BBC World"
    },
    {
      "speaker_name": null,
      "role_or_affiliation": "Senior US administration official (anonymous)",
      "speaker_type": "official",
      "speaker_affiliation_bucket": "state",
      "speaker_affiliation_kind": "US Executive Branch",
      "exact_quote": "a level playing field",
      "attributive_verb": "said",
      "stance_toward_target": "for",
      "signal_text_idx": 10,
      "bucket": "FAIRNESS",
      "outlet": "El Pais English"
    },
    {
      "speaker_name": null,
      "role_or_affiliation": "Senior US administration official (anonymous)",
      "speaker_type": "official",
      "speaker_affiliation_bucket": "state",
      "speaker_affiliation_kind": "US Executive Branch",
      "exact_quote": "does not end discriminatory conduct",
      "attributive_verb": "claims",
      "stance_toward_target": "for",
      "signal_text_idx": 10,
      "bucket": "POLICY_PRESCRIPTION",
      "outlet": "El Pais English"
    },
    {
      "speaker_name": "Trump",
      "role_or_affiliation": "US President",
      "speaker_type": "official",
      "speaker_affiliation_bucket": "state",
      "speaker_affiliation_kind": "US Executive Branch",
      "exact_quote": "I have paused the 50% Tariffs against Canada, that were scheduled to kick in tomorrow morning for three days, based on the fact that Canada and the U.S.A., subject to the finalisation of documents, have a DEAL!",
      "attributive_verb": "posted",
      "stance_toward_target": "unclear",
      "signal_text_idx": 11,
      "bucket": "EXTERNAL_REGULATION",
      "outlet": "Republic World (alt)"
    },
    {
      "speaker_name": "Majerus",
      "role_or_affiliation": "Partner at King & Spalding; former US trade official",
      "speaker_type": "expert",
      "speaker_affiliation_bucket": "corporate",
      "speaker_affiliation_kind": "King & Spalding",
      "exact_quote": "I don’t think either side really wants these tariffs to come into effect,",
      "attributive_verb": "said",
      "stance_toward_target": "neutral",
      "signal_text_idx": 11,
      "bucket": "EXTERNAL_REGULATION",
      "outlet": "Republic World (alt)"
    },
    {
      "speaker_name": "Majerus",
      "role_or_affiliation": "Partner at King & Spalding; former US trade official",
      "speaker_type": "expert",
      "speaker_affiliation_bucket": "corporate",
      "speaker_affiliation_kind": "King & Spalding",
      "exact_quote": "There’s a pretty strong push on both sides to find an off-ramp here.",
      "attributive_verb": "said",
      "stance_toward_target": "neutral",
      "signal_text_idx": 11,
      "bucket": "EXTERNAL_REGULATION",
      "outlet": "Republic World (alt)"
    }
  ],
  "model": "claude-sonnet-4-6",
  "meta_version": "10.0.3"
}
